Row1272;juridico;fornecer conhecimentos acerca da aplicacao lei anticorrupcao no ambito das empresas bem como esclarecer duvidas inerentes ao tema 
Row1273;gestao de negocios e clientes;objetivo deste dia e estabelecer o entrelacamento de comunicacao promover troca de informacoes e experiencias e de criar um espirito de tolerancia social 
Row1274;desenvolvimento de solucoes;fornecer uma visao geral sobre kanban e operacao continuada 
Row1275;desenvolvimento de solucoes;apresentar conceitos e direcionadores que podem ser usados pelas equipes de desenvolvimento para escolher um framework javascript em meio a atual proliferacao de bibliotecas padroes tecnologias e ideologias totalmente opostas 
Row1276;aquisicoes e contratacoes;capacitar os agentes do subprocesso de aplicacao de sancao a executa lo em conformidade com os normativos e processos vigentes 
Row1277;aquisicoes e contratacoes;oferecer conceitos basicos sobre gestao de contratos para fiscalizacao administrativa e fiscalizacao tecnica ao final do curso o aluno devera estar apto a realizar o acompanhamento e gerenciamento dos contratos no ambito do serpro observando e identificando desvios ou erros de execucao conforme os procedimentos de aquisicoes e contratacoes contemplados em legislacao e normatizacao especificas 
Row1278;aquisicoes e contratacoes;oferecer conceitos basicos sobre gestao de contratos para fiscalizacao administrativa e fiscalizacao tecnica ao final do curso o aluno devera estar apto a realizar o acompanhamento e gerenciamento dos contratos no ambito do serpro observando e identificando desvios ou erros de execucao conforme os procedimentos de aquisicoes e contratacoes contemplados em legislacao e normatizacao especificas 
Row1279;gestao de pessoas;o trabalho a ser desenvolvido na oficina objetiva familiarizar os participantes com os diversos conceitos relativos a saude suplementar e suas utilizacoes associando a pratica aos conhecimentos teoricos a fim de fomentar o pensamento critico acerca da materia de modo que os participantes ao final da oficina estejam aptos a disseminar os referidos conceitos aos beneficiarios do plano de saude 
Row1280;gestao de pessoas;o trabalho a ser desenvolvido na oficina objetiva familiarizar os participantes com os numeros relativos ao plano de saude do serpro associando os conhecimentos a melhor gestao das informacoes a fim de fomentar o pensamento critico acerca da materia de modo que os participantes ao final da oficina estejam aptos a orientar os beneficiarios do plano de saude sobre a importancia da utilizacao consciente 
Row1281;gestao de pessoas;contribuir para o aperfeicoamento do atendimento aos usuarios do plano de saude considerando que a questao impacta diretamente nos registros de reclamacoes na ans e na percepcao dos beneficiarios sobre o pas serpro bem como dar ciencia sobre os processos e instancias dos canais de comunicacao do plano de saude 
Row1282;gestao de pessoas;o objetivo da acao educacional e ampliar o conhecimento do gestor sobre o plano de assistencia a saude do serpro e orientar sobre procedimentos e posturas a serem adotadas pelo integrante do corpo gerencial ao receber uma solicitacao de apoio junto a operadora do pas serpro 
Row1283;gestao de pessoas;o trabalho a ser desenvolvido na oficina objetiva familiarizar os participantes com o tema notificacao de investigacao preliminar nip e seus impactos nos indices do plano de saude de modo que os mesmos ao final da oficina estejam aptos a utilizar os conhecimentos adquiridos no processo de conscientizacao dos beneficiarios objetivos especificos conhecer o conceito de nip conhecer o fluxo das nip s conscientizacao do beneficiario da importancia da utilizacao dos meios de comunicacao internos para efetivar as reclamacoes evidenciar as consequencias das nip s no indice de saude suplementar idss 
Row1284;gestao de pessoas;o trabalho a ser desenvolvido na oficina objetiva familiarizar os participantes com sistema de informacoes utilizado no pas serpro de modo que os mesmos ao final da oficina estejam aptos a utilizar o referido sistema para agilizar facilitar os atendimentos ao beneficiario objetivos especificos conhecer as ferramentas que o sistema dispoe aprender a navegar no modulo beneficiario para verificar assuntos cadastrais a navegar no modulo reembolso para verificar assuntos cadastrais e rotinas processuais referentes ao tema a realizar os testes de cobertura a verificar as senhas dentre outras questoes que possam surgir em decorrencia da utilizacao rotineira 
Row1285;gestao de pessoas;compartilhar e apresentar conhecimentos que possibilitem a familiarizacao dos participantes com a tabela de reembolso do serpro e sua utilizacao associando a pratica aos conhecimentos teoricos objetivando fomentar o pensamento critico acerca da evolucao e valoracao da tabela de modo que ao final da acao educacional os participantes possam utilizar adequadamente as ferramentas de busca e emitir orientacoes contundentes aos beneficiarios 
Row1286;gestao de negocios e clientes;capacitar os participantes a elaborar a planilha de custos e formacao de precos para contratos de terceirizacao de que trata a in slti mpog mediante a aprendizagem da metodologia de calculo dos aspectos normativos e jurisprudenciais de cada item objeto de calculo abordando se inclusive aspectos polemicos com a necessaria mencao as deliberacoes relevantes do tribunal de contas da uniao e dos tribunais superiores 
Row1287;gestao de pessoas;proporcionar elementos para reflexao sobre a construcao de um projeto de vida equilibrado e saudavel 
Row1288;tecnologia da informacao;neste curso vamos discutir conceitos relacionados a inteligencia de negocio business inteligence bi e suas aplicacoes nas organizacoes e apresentar os diversos modulos do pentaho ferramenta de bi selecionada pelo serpro para atendimento a seus clientes 
Row1289;tecnologia da informacao;demonstrar as principais ferramentas de extracao de dados da base do hisaq por intermedio do pentaho bi business intelligence 
Row1290;tecnologia da informacao;capacitar o desenvolvedor a criar transformacoes e jobs com o pentaho data integration 
Row1291;seguranca da informacao;ao final da acao educacional o aluno estara apto a encontrar e explorar falhas de seguranca em infraestrutura e aplicacoes a simular ataques reais de forma controlada e documentada e a elaborar relatorios informando as vulnerabilidades e recomendacoes para mitiga las 
Row1292;desenvolvimento de solucoes;capacitar desenvolvedores na especificacao jpa
Row1293;desenvolvimento de solucoes;fornecer e compartilhar conhecimentos essenciais acerca do processo pgps e das funcionalidades da ferramenta ferramenta hawk considerando o monitoramento das iniciativas 
Row1294;desenvolvimento de solucoes;capacitar os alunos em desenvolvimento de sites e aplicacoes web utilizando php com banco de dados bem como introduzir a utilizacao do framework zend versao 
Row1295;desenvolvimento de solucoes;capacitar empregados da area de tecnologia no uso da linguagem php e do framework laravel para atender demandas especificas relacionadas a solucoes e automacoes para servicos de rede local e de longa distancia oferecidos aos clientes do serpro 
Row1296;aquisicoes e contratacoes;capacitar a luz da legislacao vigente os principais atores no processo de planejamento de aquisicoes e contratacoes 
Row1297;tecnologia da informacao;desenvolver a capacidade para o planejamento integrado nos processos de aquisicao e contratacao de suprimentos servicos produtos e outros elementos relacionados a tecnologia da informacao no contexto do programa dgti alem de aprimorar a capacidade tecnica para avaliacao de propostas dessa tematica e de gerenciamento de contratos de tecnologia de informacao 
Row1298;tecnologia da informacao;pretende se que ao final do curso o participante adquira competencias para executar e gerenciar a aplicacao de recursos publicos nos processos de compras e contratacao de servicos de ti necessarios aos objetivos dos projetos e atividades publicas de acordo com os marcos legais e a jurisprudencia do tribunal de contas da uniao adquira capacidade de entendimento dos aspectos e processos basicos para uma adequada contratacao de servicos de ti para organizacoes publicas e adquirir embasamento teorico para a compreensao e aplicacao da in nas organizacoes publicas 
Row1299;gestao logistica;o objeto do curso e capacitar profissionais envolvidos com manutencao abordando sobre os seguintes temas como elaborar planos de manutencao rentaveis como programar corretamente atividades de manutencao gestao de custos na manutencao implantacao do pcm em pilares gestao da manutencao atraves de indicadores e manutencao centrada em confiabilidade 
Row1300;gestao empresarial;ao final da acao educacional o aluno devera estar apto a identificar as principais posturas a serem tomadas com relacao ao planejamento estrategico no serpro bem como estar sensibilizado para a internalizacao em sua equipe e saber onde encontrar maiores informacoes sobre o assunto para sua correta utilizacao em suas atividades gerenciais 
Row1301;gestao empresarial;apresentar nocoes basicas de planejamento estrategico estimulando a reflexao sobre a importancia de sua aplicacao nas organizacoes publicas 
Row1302;gestao de pessoas;ao final do curso o aluno devera assumir uma atitude positiva em relacao ao seu planejamento financeiro de tal forma que possa atingir seus objetivos pessoais principalmente constituir reservas financeiras construir patrimonio que garanta fonte de renda suficiente para ter vida tranquila e confortavel no futuro 
Row1303;gestao empresarial;a acao tem por objetivo capacitar membros das coadm e gestores de projetos no planejamento de um projeto na ferramenta hawk a ferramenta hawk e a ferramenta homologada pelo escritorio de projetos corporativo para planejamento e monitoramento dos projetos estrategicos de diretoria e de superintendes do serpro 
Row1304;gestao empresarial;a acao tem por objetivo capacitar membros das coadm e gestores de projetos no planejamento de um projeto na ferramenta hawk a ferramenta hawk e a ferramenta homologada pelo escritorio de projetos corporativo para planejamento e monitoramento dos projetos estrategicos de diretoria e de superintendes do serpro 
Row1305;aquisicoes e contratacoes;o objetivo e capacitar os participantes na elaboracao da planilha de custos e formacao de precos disciplinada pela nova in no de mediante abordagem de todos os itens que compoem a planilha em conformidade com a legislacao que rege os custos presentes na formacao de precos para a contratacao dos servicos terceirizados sua aplicabilidade ao caso em concreto e suas adaptacoes de acordo com as especificidades e realidade de cada contratacao 
Row1306;gestao empresarial;capacitar os participantes no metodo de estimativa de trabalho planning poker e ferramenta redmine 
Row1307;gestao de negocios e clientes;capacitar o participante a executar o plano de continuidade de negocios pcn do servico sid
Row1308;riscos empresariais;ao final do curso o aluno devera ser capaz de a identificar e compreender os conceitos relacionados ao tema resposta a emergencias b identificar as etapas de metodo de elaboracao de plano de resposta a emergencias c usar o metodo descrito para elaboracao de plano de resposta a emergencias dentro do contexto da unidade organizacional a que o aluno pertence 
Row1309;riscos empresariais;ao final do curso o aluno devera ser capaz de a identificar e compreender os conceitos relacionados ao tema resposta a emergencias b identificar as etapas de metodo de elaboracao de plano de resposta a emergencias c usar o metodo descrito para elaboracao de plano de resposta a emergencias dentro do contexto da unidade organizacional a que o aluno pertence 
Row1310;gestao integrada de servicos;elaborar um plano de resposta na ferramenta de worklow govi controle 
Row1311;gestao de pessoas;apresentar a importancia do planejamento alimentar e estrategias para adquirir habitos de alimentacao saudaveis 
Row1312;gestao de pessoas;ao final da acao educacional o aluno estara apto a atuar e aplicar o conhecimento basico obtido de acordo com a funcao gerencial sobre o tema planos de cargos e salarios 
Row1313;educacao corporativa;proporcionar ao aluno um ambiente de aprendizagem experiencial para prepara lo para lidar de forma mais adequada com situacoes inerentes ao universo da lideranca desenvolver competencia gerenciais para a criacao de equipes de alto desempenho como por exemplo as de comunicacao e a flexibilidade 
Row1314;gestao de negocios e clientes;preparar os gestores de negocio e controladores a utilizar o sistema que ira dar suporte ao processo de gestao comercial do serpro 
Row1315;gestao de negocios e clientes;preparar os gestores de negocio e controladores a utilizar o sistema que ira dar suporte ao processo de gestao comercial do serpro 
Row1316;gestao de negocios e clientes;preparar os gestores de negocio e controladores a utilizar o sistema que ira dar suporte ao processo de gestao comercial do serpro 
Row1317;gestao de negocios e clientes;ao final do curso os participantes deverao entender os conceitos apresentados registrar informacoes gerais de caracterizacao da demanda bem como relevantes no contexto do projeto identificar partes interessadas possiveis integracoes entre processos e sistemas restricoes e demais informacoes iniciais do projeto 
Row1318;controladoria empresarial;o evento tera como objetivo capacitar todos os empregados que estao relacionadas diretamente na elaboracao e execucao de projetos de investimento geradores de novos servicos que apresentem aumento de receitas e ou reducao de custos 
Row1319;gestao de negocios e clientes;capacitar analistas de negocio de forma que eles possam atuar junto ao cliente no levantamento dos requisitos nao funcionais dos sistemas de informacao a serem desenvolvidos pelo serpro 
Row1320;gestao empresarial;ao final do curso os participantes deverao conhecer e estar aptos a descrever o business model canvas e seus elementos a evolucao do conceito de modelo de negocio suas representacoes caracteristicas e o seu processo de desenvolvimento 
Row1321;gestao empresarial;ao final do curso os participantes deverao conhecer e estar aptos a descrever o business model canvas e seus elementos a evolucao do conceito de modelo de negocio suas representacoes caracteristicas e o seu processo de desenvolvimento 
Row1322;seguranca da informacao;apresentar a politica corporativa de seguranca da informacao e os criterios adotados pelo serpro para a classificacao da informacao propiciar a integracao e a troca de conhecimentos atraves de discussoes e exposicoes 
Row1323;desenvolvimento de solucoes;melhoria da qualidade das contagens de pf pontos de funcao com vistas a produtividade 
Row1324;inovacao de ti;discutir a importancia de entender os tipos de inovacao e o mindset digital com isso projetar novos caminhos para os negocios mais tradicionais 
Row1325;desenvolvimento de solucoes;a palestra sobre o xamarin visa apresentar as caracteristicas e recursos oferecidos por essa plataforma para o desenvolvimento de aplicacoes destinadas a dispositivos moveis 
Row1326;riscos empresariais;treinamento para administracao da ferramenta risk manager utilizada na analise de riscos do centro de certificacao digital do serpro 
Row1327;comunicacao e marketing;como curso espera se que ao final voce esteja apto a aplicar os conhecimentos da lingua portuguesa em textos escritos utilizar padroes definidos para a abordagem escrita sem perder de vista as variacoes linguisticas existentes e permitidas compreender textos sugerir temas contribuindo para os ciclos de melhoria como ferramenta de consulta espera se que o conteudo seja um suporte efetivo para o usuario na sua escrita do dia a dia 
Row1328;desenvolvimento de solucoes;capacitar alunos em tarefas administrativas do postgresql as quais vao alem de comandos sql 
Row1329;desenvolvimento de solucoes;tornar o aluno capaz de identificar os principais gargalos de desempenho no modelo de dados e consultas sql implementadas na aplicacao bem como tecnicas de otimizacao das tais a fim de minimizar o tempo de execucao gasto pelo banco de dados postgresql ao final do curso estarao aptos a entender melhor o funcionamento dos planos de execucao de consultas e demais tecnicas de desempenho relacionado a populacao de dados 
Row1330;desenvolvimento de solucoes;o treinamento visa capacitar o aluno a ter um primeiro contato com o postgresql com enfase na linguagem sql aplicada ao mesmo com seus recursos e particularidades outro grande objetivo do curso e a respeito de modelagem de banco de dados e boas praticas fazendo uso otimizado de recursos disponibilizados construindo assim um bom alicerce para evitar problemas futuros na aplicacao decorrentes de modelagem mal feita e o treinamento essencial para que o aluno possa fazer novos treinamentos de postgresql posteriormente 
Row1331;comunicacao e marketing;mostrar a importancia de uma postura e imagem profissional diante do mercado de trabalho
Row1332;comunicacao e marketing;ao final da acao educacional o aluno estara apto a atuar e aplicar o conhecimento basico obtido sobre postura empresarial 
Row1333;transparencia e etica;alertar sobre as situacoes de risco relativas a postura profissional de conduta nas redes sociais mesmo fora do ambiente da empresa e do cumprimento da jornada de trabalho 
Row1334;desenvolvimento de solucoes;apos concluir com sucesso este curso os alunos deverao ser capazes de usar o suporte informatica para resolver questoes e problemas com powercenter x usar powercenter designer x para construir mapeamentos que extraem dados de uma fonte para um destino transformando o se necessario usar transformacoes powercenter para limpar formatar juntar agregar e encaminhar os dados realizar o tratamento de erros com mapeamentos powercenter usar workflow manager x powercenter para construir e executar um fluxo de trabalho que executa as sessoes associadas a um mapeamento projetar e construir um simples mapeamento e fluxos de trabalho com base no negocio e suas necessidades entender a arquitetura e seus componentes no ambiente powercenter para o dw da rfb 
Row1335;desenvolvimento de solucoes;capacitar os responsaveis pelas atividades de testes sobre a finalidade e conteudo dos artefatos requeridos pela macroatividade de testes tornando os aptos a confeccionar os referidos produtos de trabalho utilizando o rqm alm 
Row1336;comunicacao e marketing;preparar empregados para proceder atendimento de acionamentos telefonicos e via chat referentes aos processos de gestao de pessoas bem como atuar com cordialidade leveza rapidez efetividade e conclusividade 
Row1337;comunicacao e marketing;fortalecer conhecimentos habilidades e atitudes voltados para atendimento ao publico 
Row1338;transparencia e etica;oferecer conhecimentos especificos e praticos necessarios ao atendimento de qualidade do cidadao ao tratamento das manifestacoes e pedidos de acesso a informacao e a aspectos de gestao aplicados as ouvidorias publicas possibilitando a continua melhoria dos servicos publicos prestados 
Row1339;desenvolvimento de solucoes;permitir aos alunos um contato pratico com as solucoes apresentadas habilitando os a iniciar projetos de data analytics que se utilizem delas 
Row1340;seguranca da informacao;apresentar ao aluno o conjunto de tecnicas cientificamente comprovadas utilizadas para reunir identificar examinar correlacionar analisar e apresentar evidencias digitais processadas armazenadas ou transmitidas por computadores e outros dispositivos
Row1341;desenvolvimento de solucoes;apresentar praticas que podem auxiliar as equipes de desenvolvimento a realizarem contagens e estimativas em pontos de funcao 
Row1342;controladoria empresarial;a acao educacional e voltada ao aprendizado de aplicacao de ferramentas de inteligencia de mercado e analises estatisticas para identificar oportunidades e estabelecer o preco ideal para produtos e servicos de modo a alcancar o desempenho possivel de acordo com a estrategia estabelecida para o negocio 
Row1343;controladoria empresarial;divulgar as decisoes normativas tcu e que dispoem sobre a prestacao e o julgamento das contas do exercicio de orientar sobre a elaboracao das pecas que compoem a prestacao de contas e sobre a habilitacao e uso do sistema e contas dar noticias sobre as mudancas que estao em curso no processo de prestacao de contas esclarecer duvidas dos gestores e dos representantes dos orgaos de controle interno 
Row1344;controladoria empresarial;abordar questoes relativas a elaboracao do relatorio de gestao como peca do processo de prestacao de contas do serpro fortalecer a cultura organizacional no trato das informacoes requeridas na prestacao de contas do serpro capacitar os empregados responsaveis pelas informacoes demandadas pelo relatorio de gestao do serpro de no tocante as atualizacoes das orientacoes e procedimentos para a construcao deste 
Row1345;riscos empresariais;apresentar boas praticas internacionais e solucoes testadas por meio da combinacao de experiencia internacional e conselhos praticos para a implementacao de atividades de prevencao a corrupcao
Row1346;riscos empresariais;apresentar os aspectos conceituais sobre fraude e corrupcao abordando situacoes hipoteticas de ocorrencia dessas irregularidades a fim de possibilitar ao empregado a identificacao e prevencao da ocorrencia desses atos 
Row1347;transparencia e etica;identificar quais sao os ilicitos disciplinares recorrentes encaminhados a corregedoria geral do ministerio da fazenda no ambito das suas respectivas esferas de atuacao para que possam evita los 
Row1348;gestao de pessoas;promover a participacao na luta mundial de combate ao cancer de prostata que visa incentivar o autocuidado a prevencao e o diagnostico precoce desse tipo de cancer 
Row1349;gestao de pessoas;conscientizar os participantes quanto a prevencao da doenca observando os sinais de alerta do corpo e os fatores de risco 
Row1350;gestao logistica;preparar para atuar na prevencao e no combate ao principio de incendio abandono de area e primeiros socorros visando em caso de sinistro proteger a vida e o patrimonio reduzir as consequencias sociais do sinistro e os danos ao meio ambiente 
Row1351;gestao de pessoas;fornecer conhecimentos a respeito da prevencao e combate ao assedio sexual no trabalho
Row1352;transparencia e etica;conhecer conceitos de conflito de interesses identificar e diferenciar as medidas de prevencao e repressao de conflito de interesses 
Row1353;transparencia e etica;identificar o conceito de conflito de interesses expresso na lei no reconhecer o servidor publico como detentor de direitos como cidadao privado reconhecer a legitimidade da consulta sobre conflito de interesses diferenciar as medidas de prevencao e repressao de conflito de interesses identificar a situacao da politica de prevencao de conflito de interesses no poder executivo federal e o papel dos orgaos envolvidos reconhecer a importancia de sua acao como agente na politica de prevencao e resolucao de conflito de interesses identificacao das situacoes que caracterizam conflito de interesses reconhecer a importancia da argumentacao fundamentada em uma analise preliminar sobre situacao de conflito de interesses identificar os fundamentos de uma analise preliminar sobre consulta de conflito de interesses conhecer as funcionalidades do sistema eletronico de prevencao de conflito de interesses 
Row1354;gestao de pessoas;orientar quanto a prevencao e tratamento das doencas sexualmente transmissiveis
Row1355;gestao de pessoas;espera se que ao final do curso os alunos sejam capazes de identificar conhecimentos necessarios para desempenhar as atividades que sao atribuicoes do cipista bem como relacionar quais sao estas atribuicoes espera se tambem observar nesses alunos um julgamento subjetivo positivo sobre sua capacidade de desempenha las 
Row1356;gestao de pessoas;ao promover informacoes relevantes para a promocao de seguranca de saude e prevencao de acidentes a uniserpro busca motivar cada empregado a situar se e integrar se ao conjunto de pessoas que zelam por estas condicoes para que possam atuar de forma proativa e eficaz 
Row1357;gestao de pessoas;espera se que ao final do curso os alunos sejam capazes de identificar conhecimentos necessarios para desempenhar as atividades que sao atribuicoes do cipista bem como relacionar quais sao estas atribuicoes espera se tambem observar nesses alunos um julgamento subjetivo positivo sobre sua capacidade de desempenha las 
Row1358;gestao de pessoas;espera se que ao final do curso os alunos sejam capazes de identificar conhecimentos necessarios para desempenhar as atividades que sao atribuicoes do cipista bem como relacionar quais sao estas atribuicoes espera se tambem observar nesses alunos um julgamento subjetivo positivo sobre sua capacidade de desempenha las 
Row1359;gestao de pessoas;disseminar conhecimentos com vistas a propiciar o entendimento e a participacao no processo de governanca da entidade fechada de previdencia complementar efpc serpros fundo multipatrocinado ao final do curso esperamos que o empregado seja capaz de conhecer a historia da previdencia ao longo dos tempos identificar os regimes de previdencia existentes no brasil conhecer os principais conceitos de previdencia complementar conhecer os planos de previdencia complementar do serpro serpros vantagens e beneficios 
