Row926;seguranca da informacao;o objetivo e informar e conscientizar empregados do serpro em relacao aos riscos e melhores praticas nas mais diversas areas dentro da seguranca da informacao alem de trazer temas atualizados e palestrantes experientes o evento pretende ser um palco para a troca de experiencias para todos os participantes 
Row927;seguranca da informacao;o objetivo e informar e conscientizar empregados do serpro em relacao aos riscos e melhores praticas nas mais diversas areas dentro da seguranca da informacao alem de trazer temas atualizados e palestrantes experientes o evento pretende ser um palco para a troca de experiencias para todos os participantes 
Row928;seguranca da informacao;o objetivo e informar e conscientizar empregados do serpro em relacao aos riscos e melhores praticas nas mais diversas areas dentro da seguranca da informacao alem de trazer temas atualizados e palestrantes experientes o evento pretende ser um palco para a troca de experiencias para todos os participantes 
Row929;seguranca da informacao;o objetivo e informar e conscientizar empregados do serpro em relacao aos riscos e melhores praticas nas mais diversas areas dentro da seguranca da informacao alem de trazer temas atualizados e palestrantes experientes o evento pretende ser um palco para a troca de experiencias para todos os participantes 
Row930;seguranca da informacao;o objetivo e conscientizar e educar os empregados do serpro em relacao aos riscos e melhores praticas dentro da seguranca da informacao com exemplos praticos de vulnerabilidades nais quais o serpro esteve exposto 
Row931;desenvolvimento de solucoes;capacitar os desenvolvedores do serpro em boas praticas de desenvolvimento seguro 
Row932;desenvolvimento de solucoes;realizar exercicio de simulacao de ataque cibernetico por meio de criacao de cenario ficticio envolvendo equipes com objetivos opostos ataque defesa 
Row933;desenvolvimento de solucoes;apresentar a origem das metodologias ageis e explicar principais conceitos e bases de algumas das mais utilizadas no desenvolvimento de software como lsd lean software development scrum xp e open up demonstrar tecnicas de estimativas de priorizacao e de medicao de tamanho e prazo usadas no desenvolvimento agil 
Row934;desenvolvimento de solucoes;apresentar e ou ampliar conhecimentos relativos ao papel de product owner em projetos ageis bem como de gestores de negocio nas atividades relacionadas a gestao de projetos dessa natureza 
Row935;desenvolvimento de solucoes;introducao as ferramentas de desenvolvimento impala e hive 
Row936;gestao logistica;trocar conhecimento sobre a implantacao dos metodos e ferramentas ageis na area meio do serpro mais especificamente na supgl 
Row937;seguranca da informacao;conhecer e aplicar conceitos de machineid e criptografia simetrica e assimetrica implementacao de bibliotecas de seguranca web e mobile tecnologias de rastreabilidade de acesso web e mobile mecanismos de prevencao e combate a fraude analise de eventos maliciosos e deteccao de ataques paginas falsas e trojans 
Row938;riscos empresariais;aplicar a base normativa da gestao de riscos nos processos de trabalho aplicar as principais estruturas de risco nos processos de trabalho aplicar metodos de priorizacao de processos utilizar tecnicas de identificacao de riscos elaborar matriz e mapa de riscos 
Row939;riscos empresariais;o conceituar a gestao de risco com foco na administracao publica federal o aplicar a base normativa da gestao de riscos em seus processos de trabalho o aplicar as principais estruturas de risco em seus processos de trabalho o aplicar metodos de priorizacao de processos o utilizar tecnicas de identificacao de riscos o elaborar matriz e mapa de riscos 
Row940;centro de dados;aprender como implementar banco de dados
Row941;desenvolvimento de solucoes;capacitar os alunos nas tecnologias para intermnet das coisas iot onde os mesmos aprenderao a programar o arduino e o nodemcu e ainda aprenderao a controlar varios dispositivos eletronicos sensores motores led reles lampadas entre outros por meio de aplicacoes em smartphones tablets e em aplicacoes de rede cloud c
Row943;desenvolvimento de solucoes;trocar conhecimentos experiencias entre os participantes sobre desenvolvimento mobile usando ionic framework 
Row944;riscos empresariais;capacitar servidores publicos a luz da teoria e da jurisprudencia vigente sobre improbidade administrativa 
Row945;responsabilidade social;propiciar aos participantes o acesso as tecnologias de informacao e comunicacao como processo de democratizacao e insercao de todos na sociedade da informacao 
Row946;responsabilidade social;apresentar projetos educacionais que buscam promover a inclusao digital e social e garantir a insercao do individuo na sociedade da informacao e o fortalecimento do desenvolvimento local 
Row947;gestao empresarial;compartilhar com as equipes e liderancas as funcionalidades disponibilizadas pela ferramenta alm para geracao de informacoes gerenciais e de acompanhamento de projetos 
Row949;tecnologia da informacao;passar nocoes gerais sobre ambiente de estacao de trabalho e rede local de software livre no serpro principais servicos de rede infraestrutura e boas praticas de uso 
Row950;gestao empresarial;ao final da acao educacional o aluno estara apto a atuar e aplicar o conhecimento basico obtido sobre inovacao 
Row951;responsabilidade social;apresentar projeto de acessibilidade e a importancia no uso dos deficientes 
Row952;gestao financeira;trocar conhecimento e experiencia entre os participantes sobre o contexto atual de forte inovacao nos pagamentos moveis contexto que esta tento um crescimento enorme no mundo mudando os paradigmas de como as pessoas lidam com dinheiro 
Row953;inovacao de ti;trocar conhecimento e experiencia sobre gamificacao 
Row954;gestao de pessoas;esclarecer os principais agentes que geram aposentadoria especial
Row955;seguranca da informacao;trocar conhecimento e experiencia entre os participantes sobre internet das coisas 
Row956;seguranca da informacao;trocar conhecimento e experiencia entre os participantes sobre internet das coisas 
Row957;gestao de pessoas;dialogar sobre autoconhecimento autoestima confianca e resiliencia como ferramentas para enfrentar as adversidades que surgem ao longo de nossas vidas 
Row958;gestao de pessoas;promover um espaco publico para que o inss exponha os criterios norteadores de avaliacao de incapacidade de seus segurados e reabilitacao profissional estabelecer um forum de discussao sobre procedimentos administrativos e periciais avaliar a possibilidade de um grupo permanente para dialogar sobre temas polemicos referentes a agravos relacionados ao trabalho e a incapacidade
Row959;gestao de pessoas;promover um espaco publico para que o inss exponha os criterios norteadores de avaliacao de incapacidade de seus segurados e reabilitacao profissional estabelecer um forum de discussao sobre procedimentos administrativos e periciais avaliar a possibilidade de um grupo permanente para dialogar sobre temas polemicos referentes a agravos relacionados ao trabalho e a incapacidade
Row960;centro de dados;capacitar os participantes para instalacao e configuracao de ambiente apache hadoop por meio do uso de uma distribuicao hadoop 
Row961;centro de dados;treinar equipes da supcd para projetar solucoes para a sustentacao e evolucao da plataforma estaleiro ao final do curso o aluno devera ter compreendido o funcionamento basico de um cluster kubernetes de modo gerar solucoes para o ambiente de producao 
Row962;desenvolvimento de solucoes;esta acao educacional visa ajudar as equipes de desenvolvimento do serpro a utilizar a integracao continua em seus projetos de software com foco nas ferramentas disponibilizadas pelo serpro e na linguagem de programacao java ao final do curso o aluno devera estar apto a criar e configurar job s no jenkins para compilar seus projetos de forma continua integrada com o maven e o nexus e enviando a analise de codigo para o sonar a criacao e configuracao de ambientes na nuvem do serpro tambem sera abordada na teoria e na pratica 
Row963;desenvolvimento de solucoes;esta acao educacional visa ajudar as equipes de desenvolvimento do serpro a utilizar a integracao continua em seus projetos de software com foco nas ferramentas disponibilizadas pelo serpro e na linguagem de programacao java ao final do curso o aluno devera estar apto a criar e configurar job s no jenkins para compilar seus projetos de forma continua integrada com o maven e o nexus e enviando a analise de codigo para o sonar a criacao e configuracao de ambientes na nuvem do serpro tambem sera abordada na teoria e na pratica 
Row964;desenvolvimento de solucoes;a acao educacional visa auxiliar as equipes a automatizar builds facilitando a integracao continua em uma ampla variedade de projetos em diversas linguagens e tecnologias durante o curso o aluno sera apresentado a conceitos de integracao continua como a configuracao do jenkins em projetos java e php e a criacao e configuracao de jobs o curso possui foco pratico em situacoes do cotidiano dentre outros topicos sera revisto praticas de integracao continua incluindo uma introducao ao plugin maven 
Row965;gestao empresarial;proporcionar o compartilhamento de boas praticas de gestao entre os diferentes orgaos envolvidos para encontrar oportunidades de melhorias nos processos e servicos adotados firmando um protocolo de intencoes 
Row966;transparencia e etica;o objetivo da acao educacional e disponibilizar os conceitos relacionados ao programa de integridade do serpro contribuindo para a sensibilizacao e reflexao dos participantes sobre os temas etica prevencao e combate a corrupcao 
Row967;riscos empresariais;o objetivo da acao educacional e disponibilizar os conceitos relacionados ao programa de integridade do serpro contribuindo para a sensibilizacao e reflexao dos participantes sobre os temas etica prevencao e combate a corrupcao 
Row968;transparencia e etica;fornecer nocoes basicas sobre compliance anticorrupcao relacionando o aos temas gestao de riscos e integridade 
Row970;seguranca da informacao;o evento tem por objetivo discutir o impacto da inteligencia artificial no direito 
Row972;gestao de pessoas;melhorar o relacionamento com as pessoas no trabalho como chave para alcancar os objetivos profissionais 
Row973;gestao de pessoas;gerar reflexao sobre como cada individuo pode trabalhar sua mente para alcancar seu verdadeiro potencial 
Row974;tecnologia da informacao;apresentar o programa uno e as acoes para intensificar o uso do agil apresentar a experiencia de uso do estaleiro em producao em um caso real irpf 
Row975;controladoria empresarial;atualizacao dos conhecimentos sobre a convergencia das praticas contabeis brasileiras com as praticas contabeis internacionais 
Row976;desenvolvimento de solucoes;capacitar na plataforma serpro de iot cada aluno aprendera a utilizar e gerenciar a plataforma de internet das coisas possibilitando o em seguida desenvolver solucoes de negocios dentro do escopo de atuacao do serpro para tal o curso se baseara em apresentacao teorica de conteudo e implementacao pratica de prototipos utilizando hardwares e protocolos especificos do tema iot tais como arduino e nodemcu sensores motores led relese lampadas e smartphones tablets na oportunidade cada aluno conhecera a estrategia de uso da tecnologia iot do serpro e o funcionamento da plataforma de iot do serpro 
Row977;desenvolvimento de solucoes;apresentar o framework angularjs e sua integracao a uma aplicacao demoiselle rest com o objetivo de capacitar desenvolvedores a desenvolver aplicacoes utilizando essa tecnologia 
Row978;desenvolvimento de solucoes;ao final do curso o aluno devera ter compreendido como melhor utilizar a ferramenta sentry de modo a facilitar as boas praticas dos processos funcionais da aplicacao 
Row979;centro de dados;descrever abrangente sobre o que e ciencia de dados e porque a profissao de cientista de dados esta em alta demanda em todo o mundo e apontar a relacao entre ciencia de dados e big data os principais conceitos ligados a data science e as profissoes relacionadas 
Row980;centro de dados;neste curso voce tera uma introducao abrangente sobre o que e ciencia de dados e porque a profissao de cientista de dados esta em alta demanda em todo o mundo voce vai aprender a relacao entre ciencia de dados e big data os principais conceitos ligados a data science e as profissoes relacionadas 
Row981;gestao empresarial;ao final do curso espera se que o estudante obtenha conhecimentos basicos sobre gestao de projetos 
Row982;gestao empresarial;apresentar nocoes basicas sobre gestao de processos pratica que permite alinhar os processos aos objetivos estrategicos da organizacao eliminando falhas extinguindo atividades que nao agregam valor e mantendo o foco em seus clientes 
Row983;gestao empresarial;apresentar aos servidores publicos com foco em governanca publica os conceitos gerais de governanca principios diretrizes modelos e outros elementos relacionados ao assunto de forma a permitir que o participante possa identificar entender discernir e aplicar na medida do possivel a governanca publica dentro do contexto do orgao em que atua com base em instrumentos concebidos e difundidos por orgaos publicos assim como normativos e outros referenciais governamentais como a politica de governanca da administracao publica federal direta autarquica e fundacional 
Row984;gestao empresarial;apresentar aos servidores publicos com foco em governanca publica os conceitos gerais de governanca principios diretrizes modelos e outros elementos relacionados ao assunto de forma a permitir que o participante possa identificar entender discernir e aplicar na medida do possivel a governanca publica dentro do contexto do orgao em que atua com base em instrumentos concebidos e difundidos por orgaos publicos assim como normativos e outros referenciais governamentais como a politica de governanca da administracao publica federal direta autarquica e fundacional 
Row986;governanca de ti;agregar conhecimentos sobre interoperabilidade como meio eficaz e eficiente na troca de informacoes entre pessoas organizacoes e sistemas abordando a padronizacao e a disponibilizacao de servicos eletronicos interoperaveis a acessibilidade digital e a abertura de dados 
Row987;desenvolvimento de solucoes;fazer com que o aluno ao final do curso esteja apto a desenvolver projetos java web basicos usando jsf e primefaces 
Row988;desenvolvimento de solucoes;capacitar a equipe de desenvolvimento para projetos java web basicos usando jsf e primefaces ao final do curso o aluno devera estar apto a desenvolver projetos java web basicos usando jsf e primefaces 
Row989;responsabilidade social;ensinar a utilizar a lingua brasileira de sinais libras de forma a garantir o atendimento e o tratamento adequado as pessoas com deficiencia auditiva a lei no legitima a libras como idioma advindo das comunidades surdas brasileiras e obriga o poder publico em geral a adotar formas institucionalizadas de apoiar o uso e a difusao dessa lingua como meio de comunicacao 
Row990;desenvolvimento de solucoes;ao final do curso os alunos deverao ser capazes de identificar os principios basicos que regem a teoria da programacao orientada a objetos identificar as estruturas e a sintaxe de programacao da linguagem de programacao java 
Row991;desenvolvimento de solucoes;capacitar desenvolvedores de sistemas com experiencia em outras linguagens de programacao para desenvolverem consultas e manutencoes de banco de dados utilizando linguagem sql 
Row992;desenvolvimento de solucoes;preparar desenvolvedores para absorcao de sistemas com arquitetura demoiselle baseando se no uso das ferramentas jdk java ee maven jsf jpa e cdi
Row993;juridico;ao final do curso o aluno estara atualizado em relacao a teoria do direito constitucional 
Row994;centro de dados;introducao ao dw componentes do dw arquitetura de dw dimensoes globais artefatos do dw modelagem dimensional modelo conceitual erd especificacao de requisitos dimensionais modelo fisico prd planilha de rastreabilidade dimensional introducao ao dw componentes do dw arquitetura de dw dimensoes globais artefatos do dw modelagem dimensional modelo conceitual erd especificacao de requisitos dimensionais modelo fisico prd planilha de rastreabilidade dimensional capacitar area de desenvolvimento nos conceitos basicos de data warehousing e tecnicas de modelagem dimensional 
Row995;centro de dados;ao final do curso o aluno estara apto a compreender e produzir a modelagem dimensional dentro do padrao do rfb serpro 
Row996;desenvolvimento de solucoes;capacitar o publico alvo a mapear processos utilizando a ferramenta epf composer
Row997;desenvolvimento de solucoes;introduzir os conceitos e praticas do framework angular no desenvolvimento de aplicacoes web 
Row998;desenvolvimento de solucoes;introduzir os conceitos e praticas do framework angular no desenvolvimento de aplicacoes web 
Row999;desenvolvimento de solucoes;introduzir os conceitos e praticas do framework angular no desenvolvimento de aplicacoes web 
Row1001;gestao integrada de servicos;capacitar o aluno para compreender os conceitos estrutura atividades e atores envolvidos no processo de gerenciamento de demanda e aplicar os conhecimentos adquiridos na execucao de suas atividades cotidianas e na reducao de desvios no processo de gerenciamento de demanda do psgis 
Row1002;gestao integrada de servicos;capacitar o aluno para compreender os conceitos estrutura atividades e atores envolvidos no processo de gerenciamento de eventos e aplicar os conhecimentos adquiridos na execucao de suas atividades cotidianas e na reducao de desvios no processo de gerenciamento de eventos do psgis 
Row1003;gestao integrada de servicos;capacitar o aluno para compreender os conceitos estrutura atividades e atores envolvidos no processo de gerenciamento de problema e aplicar os conhecimentos adquiridos na execucao de suas atividades cotidianas e na reducao de desvios no processo de gerenciamento de problema do psgis 
Row1004;gestao de negocios e clientes;apresentar os conceitos basicos atinentes a gestao de processos de negocio e compartilhar conhecimentos utilizando atividade pratica e elementos de gamificacao 
Row1005;gestao de negocios e clientes;ao final do curso o aluno devera ser capaz de entender os conceitos basicos de gestao de riscos de processos de negocio e seu alinhamento aos riscos corporativos conhecer a metodologia adotada pelo escritorio de processos do serpro para a gestao de riscos de processos de negocio realizar os exercicios praticos baseados na metodologia a gestao de riscos de processos de negocio identificar os riscos dos processos de sua unidade organizacional tratar os riscos dos processos de sua unidade organizacional 
Row1006;centro de dados;capacitar os participantes nos recursos oferecidos pela plataforma de analise de dados governamentais govdata
Row1007;centro de dados;o workshop de introducao ao govdata tem por objetivo apresentar aos alunos os recursos oferecidos na plataforma de analise de dados governamentais govdata englobando o apresentacao da plataforma govdata o exploracao das bases de dados disponibilizadas o construcao de consultas de dados o upload de arquivos e criacao de bases de dados proprias o cruzamento de dados entre bases distintas o uso de ferramentas de descoberta de dados e exploracao visual o uso de ferramentas de analise estatistica o uso de ferramentas para compartilhamento de scripts 
Row1008;centro de dados;capacitar os participantes nos recursos oferecidos pela plataforma de analise de dados governamentais govdata
Row1009;centro de dados;pretende se que ao final do curso os alunos sejam capazes de entender os conceitos da jpa e utiliza la para inserir e recuperar dados para aplicacoes atraves da api em uma base de dados relacionais 
Row1010;tecnologia da informacao;treinar equipes da supcd para projetar solucoes e evolucao da plataformas estaleiro 
Row1013;centro de dados;apresentar as nocoes de maninframe utilizando roscoe jcl utilitarios endevor natural e adabas 
Row1014;centro de dados;apresentar os conceitos basicos sobre o banco de dados oracle e seus principais objetos utilizacao de comandos sql e criacao de rotinas usando a linguagem pl sql
Row1015;gestao integrada de servicos;o objetivo do curso e capacitar os empregados no processo serpro de gerenciamento integrado de servicos psgis de forma a promover a busca pelo conhecimento do processo e assim apoiar no seu cumprimento e evolucao o curso busca proporcionar aos alunos uma visao geral sobre os processos de gerenciamento de servicos de ti em uso na organizacao mesmo aqueles processos que nao estao diretamente vinculados as areas de atuacao dos alunos mas que se integram ou interagem entre si ao final do curso o aluno devera conhecer a fundamentacao teorica os conceitos a estrutura e a visao geral das atividades e atores envolvidos em cada processo do psgis alem de encontrar o caminho para identificar se no contexto do gerenciamento integrado de servicos na empresa e obter esclarecimento de como contribuem para o alcance dos objetivos da organizacao 
Row1016;centro de dados;o curso introducao ao qliksense tem por objetivo apresentar aos alunos a referida ferramenta de data discovery e seus recursos mais basicos 
Row1017;centro de dados;apresentar aos alunos a referida ferramenta de data discovery e seus recursos mais basicos 
Row1018;centro de dados;o curso introducao ao qlik sense tem por objetivo capacitar os alunos na referida ferramenta de data discovery e seus recursos essenciais 
Row1019;desenvolvimento de solucoes;capacitar os colaboradores com relacao ao uso dos comandos basicos do shell script logica de controle redirecionamentos e manipulacao de caracteres 
Row1020;gestao de negocios e clientes;apresentar o funcionamento e regras de negocio do sistema siconv
Row1022;gestao de negocios e clientes;capacitar disseminadores para a realizacao de treinamentos direcionados aos usuarios finais do sistema portolog cadeia logistica portuaria a ser implantado em novembro no porto de santos 
Row1023;gestao de negocios e clientes;introducao ao sistema portolog cadeia logistica portuaria inteligente
Row1024;desenvolvimento de solucoes;apresentar a linguagem de programacao swift que a partir de comecou a ser adotada para o desenvolvimento de aplicacoes na plataforma ios tvos watchos os x 
Row1027;desenvolvimento de solucoes;o aluno ao final do curso devera ser capaz de compreender a plataforma tibco e seus principais componentes sua aplicabilidade e ser capaz de identificar cenarios de integracao em que a plataforma possa ser utilizada 
Row1028;desenvolvimento de solucoes;capacitar desenvolvedores de sistemas com experiencia em outras linguagens de programacao para desenvolverem com a linguagem java 
Row1029;desenvolvimento de solucoes;este curso tem a oferecer conceitos fundamentais sobre a programacao orientada a objetos de forma independente de qualquer linguagem de programacao 
Row1030;ambientes de redes de ti;aprendera conceitos importantes sobre como as redes funcionam para isso abordamos temas como tipos de redes meios e formas de transmissao de dados cabeamento estruturado arquitetura de redes protocolo tcp ip entre outros 
Row1031;seguranca da informacao;ao final da palestra o aluno devera estar apto a identificar as principais posturas a serem tomadas com relacao a seguranca da informacao no serpro bem como estar sensibilizado para a adocao das mesmas e saber onde encontrar maiores informacoes sobre o assunto para sua correta utilizacao em suas atividades laborais 
Row1032;desenvolvimento de solucoes;informar aos alunos aspectos basicos relacionados a design implementacao e execucao de testes de desempenho com a ferramenta apache jmeter 
Row1033;juridico;atualizacao da legislacao a ser aplicada na elaboracao da ecd ecfdo serpro 
Row1038;organizacao da informacao empresarial;aprofundar e atualizar estudos no campo da arquivologia 
Row1039;desenvolvimento de solucoes;evento com o objetivo de compartilhar conhecimento e integracao dos membros do dedat e demais areas do serpro envolvidas na area de arquitetura de software oficina debate sobre os temas abordados nas palestras e alinhamento geral das diretrizes para a area de arquitetura
Row1040;desenvolvimento de solucoes;evento com o objetivo de compartilhar conhecimento e integracao dos membros do dedat e demais areas do serpro envolvidas na area de arquitetura de software palestras troca de conhecimento e apresentacao de informacoes referente as tendencias tecnologicas e acoes desenvolvidas nas diretorias de operacoes e desenvolvimento relacionadas a arquitetura de desenvolvimento 
Row1041;desenvolvimento de solucoes;evento com o objetivo de compartilhar conhecimento e integracao dos membros do dedat e demais areas do serpro envolvidas na area de arquitetura de software palestras troca de conhecimento e apresentacao de informacoes referente as tendencias tecnologicas e acoes desenvolvidas nas diretorias de operacoes e desenvolvimento relacionadas a arquitetura de desenvolvimento 
Row1042;desenvolvimento de solucoes;evento com o objetivo de compartilhar conhecimento e integracao dos membros do dedat e demais areas do serpro envolvidas na area de arquitetura de software palestras troca de conhecimento e apresentacao de informacoes referente as tendencias tecnologicas e acoes desenvolvidas nas diretorias de operacoes e desenvolvimento relacionadas a arquitetura de desenvolvimento 
Row1043;desenvolvimento de solucoes;evento com o objetivo de compartilhar conhecimento e integracao dos membros do dedat e demais areas do serpro envolvidas na area de arquitetura de software palestras troca de conhecimento e apresentacao de informacoes referente as tendencias tecnologicas e acoes desenvolvidas nas diretorias de operacoes e desenvolvimento relacionadas a arquitetura de desenvolvimento 
