Row0;aquisicoes e contratacoes;participar do maior encontro nacional de compras publicas nao e apenas se capacitar mas sim se preparar com o mais alto padrao de qualidade aproveitar a presenca dos maiores doutrinadores do pais e trocar experiencias com colegas de profissao 
Row1;gestao de pessoas;convocar a integracao uniao e ampliacao da classe para cuidarmos da saude dos hospitais para que eles cuidem da saude das pessoas pois nenhuma instituicao privada e de maior interesse publico do que um hospital particular conclui luiz aramicy pinto presidente da federacao brasileira de hospitais 
Row2;aquisicoes e contratacoes;atualizacao das melhores praticas nas contratacoes publicas buscando maior eficiencia nos processos administrativos implementacao da lei no serpro e as alteracoes advindas pela nova legislacao entender os impactos da nova legislacao trabalhista na contratacao de servicos terceirizados entender como as inovacoes mercadologicas impactam ou poderao impactar no processo de compra publica e na vida do comprador atualizacao quanto a jurisprudencia do tribunal de contas da uniao capacitacao para melhor implementar os mapas de riscos responsabilidades e as peculiaridades do planejamento da licitacao 
Row3;inovacao de ti;potencializar a geracao de negocios no ecossistema digital do parana incrementar a competitividade das empresas de tecnologia e inovacao ampliar as politicas publicas para consolidar o parana como estado digital disseminar o uso massivo de tecnologia digital para a sociedade 
Row4;aquisicoes e contratacoes;discutir temas que vao desde o planejamento orcamentario e politicas publicas ate como combater a corrupcao em licitacoes 
Row5;ambientes de redes de ti;participacao do certforum forum de certificacao digital com a participacao de diversos clientes e apresentacao do neoid eplo serpro em palestra do ulysses machado
Row6;desenvolvimento de solucoes;maior encontro de comunidades de software livre do mundo compartilhar conhecimentos e inovacoes mas tambem inquietacoes em busca do nosso objetivo comum construir uma humanidade mais justa colaborativa e com conhecimento livre 
Row7;ambientes de redes de ti;apresentar e discutir recentes tendencias na area de redes de computadores revisao da literatura sobres computacao em nuvem aplicacoes e ferramentas apresentacao da solucao de infraestrutura como servico iaas openstack objetivando a criacao das redes como servico naas alem de mostrar exemplos de arquiteturas projetos de pesquisas e produtos 
Row8;ambientes de redes de ti;apresentar e discutir recentes tendencias na area de redes de computadores revisao da literatura sobres as propostas de novas arquiteturas para internet de redes de conteudo e de redes definidas por software nas redes definidas por software do ingles software defined networking sdn sera abordado a separacao de plano de controle de plano de rede novas abstracoes e implementacoes de planos de controle protocolo openflow visao de pesquisa e visao de mercado exemplos de arquiteturas projetos de pesquisas e produtos comerciais 
Row9;responsabilidade social;apresentar os desafios da mulher empreendedora no brasil 
Row10;ambientes de redes de ti;ao final do curso o aluno devera ter compreendido melhor as atividades operacionais realizadas no centro de certificacao digital do serpro de modo a facilitar sua atuacao em condicoes de sobreaviso 
Row11;gestao empresarial;promover o debate entre governo e mercado sobre temas relativos a governanca corporativa em estatais
Row12;riscos empresariais;apresentar a importancia de aplicacao do compliance e atuacao dos advogados sobre o tema 
Row13;seguranca da informacao;o objetivo do seminario e fortalecer a cultura de seguranca nos empregados do serpro por meio de palestras abordando temas relevantes 
Row14;seguranca da informacao;fortalecer a cultura de seguranca dos empregados do serpro por meio de palestras abordando temas relevantes 
Row15;gestao de pessoas;tratar aspectos do envelhecimento com qualidade de vida 
Row16;gestao de negocios e clientes;tendo em vista a necessidade de aperfeicoamento sobre o esocial para os orgaos publicos especificamente nas areas de folha de pagamento saude e seguranca no trabalho e tecnologia da informacao convidamos os integrantes da administracao publica da uniao estados municipios capitais e distrito federal bem como os militares a participarem do workshop que sera conduzido pelo comite gestor do esocial composto por representantes da secretaria da receita federal do brasil secretaria de previdencia do ministerio da fazenda ministerio do trabalho instituto nacional do seguro social e caixa 
Row17;gestao contabil;oportunidade unica para a discussao da evolucao da classe contabil pois se constitui em um cenario de oportunidades de negocios alem de oferecer ao publico presente um otimo momento para a troca de ideias e experiencias e um palco de debates sobre procedimentos tecnicas evolucao e atualizacao de conhecimentos e realidade global e um ponto de convergencia uniformidade e profissionalismo em cujos principios normas e etica formam o tripe da sua realizacao 
Row18;ambientes de redes de ti;participar do encontro dos sistemas autonomos da internet no brasil 
Row19;controladoria empresarial;divulgar e incentivar a producao cientifica
Row20;ambientes de redes de ti;oferecer um ambiente para o dialogo sobre os principais assuntos relacionados a infraestrutura da internet no brasil e de forma particular sobre os pontos de troca de trafego internet ou internet exchanges 
Row21;gestao empresarial;discutir o papel a ser desempenhado por ambientes de inovacao e mecanismos de geracao de empreendimentos nesse contexto no brasil e no mundo e a proposta da conferencia anprotec deste ano 
Row22;ambientes de redes de ti;apresentar e discutir recentes tendencias na area de redes de computadores revisao da literatura sobres computacao em nuvem aplicacoes e ferramentas apresentacao da solucao de infraestrutura como servico iaas openstack objetivando a criacao das redes como servico naas alem de mostrar funcionalidades de gerenciamento e monitoramento 
Row23;ambientes de redes de ti;capacitar os profissionais da area de infraestrutura de redes e desenvolvimento tecnologico a utilizar um controlador entender a logica do funcionamento dos controladores em geral e garantir que os profissionais consigam desenvolver suas proprias aplicacoes de redes 
Row24;inovacao de ti;proporcionar um ambiente atrativo com conteudo de alto nivel e networking bastante qualificado com os melhores agentes de ecossistema brasileiro de inovacao e empreendedorismo 
Row25;inovacao de ti;mostrar as tendencias de mercado para e gov 
Row26;seguranca da informacao;disseminar e fortalecer a cultura de seguranca junto a todo corpo gerencial e funcional da empresa por intermedio de acoes educacionais que oportunizem conhecimentos acerca de temas estrategicos a organizacao 
Row27;seguranca da informacao;fortalecer a cultura de seguranca dos empregados do serpro por meio de palestras abordando temas relevantes 
Row28;riscos empresariais;disseminar boas praticas e promover debate sobre temas relevantes para a comunidade de auditoria do setor publico 
Row29;riscos empresariais;o objetivo do evento e disseminar boas praticas e promover debate sobre temas relevantes para a comunidade de auditoria do setor publico 
Row30;seguranca da informacao;entender o funcionamento da dark web e as caracteristicas do tor alem dos conceitos relacionados a estes temas 
Row31;centro de dados;o simposio brasileiro de banco de dados sbbd reune pesquisadores estudantes e profissionais do brasil e do exterior que apresentam e discutem temas relacionados aos ultimos avancos da area 
Row32;ambientes de redes de ti;o evento representa oportunidade local de aquisicao de conhecimento e atualizacao tecnologica uma vez que os empregados alem de assistir as apresentacoes das sessoes tecnicas e palestras poderao realizar minicursos como por exemplo i big data analytics no projeto de redes moveis modelos protocolos e aplicacoes ii sistemas de transporte inteligentes conceitos aplicacoes e desafios iii experimental wireless networking research using software defined radios iv fiscalizacao da neutralidade da rede conceitos e tecnicas v mecanismos de autenticacao e autorizacao para nuvens computacionais definicao classificacao e analise de solucoes e vi comunicacao por luz visivel conceito aplicacoes e desafios participar do workshop da rede nacional de ensino e pesquisa rnp e participar de paineis envolvendo representantes do mercado e da academia 
Row33;gestao de pessoas;participar das melhores praticas de fundos de pensao 
Row34;gestao de pessoas;a edicao temos uma proposta diferente levar a previdencia complementar fechada a novas fronteiras por essa razao nas plenarias do evento priorizaremos a discussao de respostas e propostas para um novo tempo e nas apresentacoes tecnicas promoveremos ambiente para troca de experiencias praticas e debate de temas relacionados ao dia a dia das entidades 
Row35;gestao de negocios e clientes;abordar as principais tematicas que norteiam o municipalismo 
Row36;responsabilidade social;debater e incentivar empresarios presidentes diretores autoridades publicas e todos os profissionais que atuam na gestao e influencia de pessoas a exercerem protagonismo contribuindo para a discussao e elevacao das questoes que envolvem a diversidade equidade de genero e lideranca feminina em todos os segmentos e niveis hierarquicos da sociedade brasileira 
Row37;seguranca da informacao;promover o compartilhamento de praticas de seguranca e protecao de dados ao utilizar essa nova tecnologia a iot traz enormes desafios para sua implementacao um deles e a questao de seguranca e privacidade e preciso constituir mecanismos de gerenciamento de confianca que possibilitem estabelecer conexoes seguras 
Row38;seguranca da informacao;fortalecer a cultura de seguranca dos empregados do serpro por meio de palestras abordando temas relevantes
Row39;gestao de pessoas;disponibilizar fomento a conhecimentos no ambito de recursos humanos afetos a estrategia gestao lideranca tendencias de mercado 
Row40;ambientes de redes de ti;o evento e promovido pelo nic br e cgi br para debater assuntos relacionados a boas praticas para a internet no brasil o grupo de trabalho de engenharia e operacao de redes gter e o grupo de trabalho em seguranca de redes gts se reunem desde e nesse evento o gter trata principalmente de aspectos praticos e operacionais da atualidade dos servicos internet no pais e o gts trata principalmente de aspectos praticos e operacionais nao proprietarios da atualidade da seguranca da internet 
Row41;seguranca da informacao;trazer experiencias do mercado na area de seguranca da informacao e estimular o debate sobre o tema no ambito do serpro alem de fortalecer a cultura de seguranca 
Row42;controladoria empresarial;o seminario tem o objetivo de promover o compartilhamento de experiencias e boas praticas relacionadas ao uso de tecnicas de analise e mineracao de dados como instrumento para melhoria da gestao e do controle de entidades e politicas publicas 
Row43;controladoria empresarial;o seminario tem o objetivo de promover o compartilhamento de experiencias e boas praticas relacionadas ao uso de tecnicas de analise e mineracao de dados como instrumento para melhoria da gestao e do controle de entidades e politicas publicas 
Row44;transparencia e etica;capacitar os servidores dos orgaos e entidades aderentes ao programa de fomento a integridade publica profip para que possam desenvolver planos de integridade nas instituicoes 
Row45;seguranca da informacao;discutir assuntos relacionados com tratamento de incidentes e resiliencia das organizacoes face a incidentes de seguranca 
Row46;gestao de pessoas;o evento tem como objetivo a atualizacao e troca de experiencias referentes a saude suplementar principalmente aqueles relacionados as autogestoes 
Row47;gestao de pessoas;fomentar o debate de questoes que impactam diretamente no desenvolvimento do segmento de previdencia complementar e reune cerca de representantes de diversas entidades fechadas do parana santa catarina e rio grande do sul 
Row48;seguranca da informacao;fornecer conhecimentos acerca da norma abnt nbr iso iec e os beneficios de adota la como parte do processo de gestao de seguranca da informacao 
Row49;gestao tributaria;oferecer conhecimentos ao treinamento a fim de que os mesmos tenham contato com o conteudo dos itens informacionais contidos neste tema bem como tenham conhecimento nos recursos da ferramenta a fim de fazer as consultas necessarias ao seu trabalho
Row50;desenvolvimento de solucoes;introduzir o conhecimento e as necessidades de acessibilidade nos portais e sitios a serem desenvolvidos apos a capacitacao o participante estara apto a desenvolver portais nos padroes acessiveis 
Row51;desenvolvimento de solucoes;introduzir o conhecimento e as necessidades de acessibilidade nos portais e sitios a serem desenvolvidos apos a capacitacao o participante estara apto a desenvolver portais nos padroes acessiveis 
Row52;desenvolvimento de solucoes;conhecer as principais recomendacoes de acessibilidade na web 
Row53;responsabilidade social;demonstrar as bases normativas conceituais e operacionais que podem ser utilizadas na aplicacao da lei de acesso a informacao lai oferecendo subsidios aos cidadaos e a administracao publica em geral para a realizacao consciente e eficiente de atos relacionados a essa area 
Row54;gestao de pessoas;discutir as principais acoes de prevencao e controle do aedes aegypti para a prevencao das arboviroses 
Row55;gestao de pessoas;disseminar as principais acoes de prevencao e controle do aedes aegypti para a prevencao das arboviroses 
Row56;responsabilidade social;repassar informacoes sobre os residuos que podem compor a coleta seletiva no nosso municipio sobre o projeto poa sem bituca e sobre a lei complementar de janeiro que dispoe sobre o codigo de limpeza urbana 
Row57;gestao integrada de servicos;disseminar rotinas de acompanhamento dos ri incidentes at atividades relativas a incidentes visando a melhoria dos indicadores da supop 
Row58;comunicacao e marketing;apresentar como funciona a comunicacao interna nas organizacoes na era virtual 
Row59;desenvolvimento de solucoes;apresentar os conceitos arquitetura e utilitarios do sgbd adabas de modo a permitir aos desenvolvedores do defla um melhor rendimento nos repasses dos sistemas de alta plataforma da ssbsa antiga debsa 
Row60;desenvolvimento de solucoes;capacita os empregados que atuam como dba para uso do sgbd adabas da plataforma grande porte mainframe 
Row61;desenvolvimento de solucoes;capacitar os treinandos a desenvolver e ou manter programas na linguagem de programacao natural acessando o sgbd adabas 
Row62;ambientes de redes de ti;consolidar os conhecimentos em thunder adc application delivery controller para que os profissionais estejam aptos a entender e manusear os equipamentos a serie thunder adc e uma nova geracao de load balancer que ajuda as empresas e isps a dimensionar e maximizar a disponibilidade e a confiabilidade dos aplicativos compativel com os protocolos ipv e ipv o treinamento e composto de material apresentando a teoria assim como a pratica de tais conceitos atraves de laboratorios focados em cada modulo 
Row63;ambientes de redes de ti;capacitar equipes tecnicas da supop para administrar a central de pacotes 
Row64;ambientes de redes de ti;instruir equipes tecnicas da supop a realizar administracao da solucao central de pacotes
Row65;ambientes de redes de ti;realizacao de workshop entre as equipes de administracao de rede local do cliente rfb das localidades gerenciadas pela opbhe
Row66;ambientes de redes de ti;realizacao de workshop entre as equipes de administracao de rede local da rede interna do serpro e clientes nao rfb das localidades gerenciadas pela opbhe 
Row67;ambientes de redes de ti;capacitar em nivel basico administradores de rede para atuacao em ambientes linux 
Row68;ambientes de redes de ti;capacitar em nivel basico administradores de rede para atuacao em ambiente windows 
Row69;ambientes de redes de ti;ao final deste curso o aluno devera ser capaz de desenvolver as competencias basicas necessarias a execucao de atividades de suporte de primeiro segundo e terceiro niveis nas areas operacionais da empresa devera desenvolver tambem as habilidades comuns da administracao de sistemas linux como o uso dos comandos basicos e avancados do shell localizacao de diretorios e arquivos de configuracao gerenciamento de pacotes gerenciamento de servicos e tarefas bem como nocoes de redes e seguranca 
Row70;ambientes de redes de ti;adquirir conhecimentos e obter melhor desenvolvimento ao aplicar no dia a dia 
Row71;gestao de pessoas;ao final do curso os participantes deverao ser capazes de compreender e aplicar os conhecimentos adquiridos sobre a administracao do tempo no seu dia a dia 
Row72;centro de dados;necessidade de implementacao de integracoes de dados de gestao e producao da supop na plataforma postgresql 
Row73;seguranca da informacao;o treinamento na solucao bry psbio bio ac e um curso de ha presencial com conteudo teorico e pratico visando o repasse de conhecimento sobre o uso e manutencao da solucao bry psbio 
Row74;desenvolvimento de solucoes;capacitacao para administradores de sistemas que desejam automatizar as configuracoes dos seus sistemas e aplicacoes com ansible awx 
Row75;gestao contabil;apresentar a evolucao do processo de prestacao de contas em especial a adocao da estrutura internacional de relato integrado
Row76;ambientes de redes de ti;capacitar os participantes no desenvolvimento da atividade de agente de registro 
Row77;ambientes de redes de ti;capacitar funcionarios do ciasc para exercer a atividade de agente de registro
Row78;ambientes de redes de ti;capacitar os participantes no desenvolvimento da atividade de agente de registro da receita federal do brasil 
Row79;ambientes de redes de ti;capacitar os participantes no desenvolvimento da atividade de agente de registro da receita federal do brasil 
Row80;ambientes de redes de ti;capacitar os empregados no desenvolvimento da atividade de agente de registro 
Row81;ambientes de redes de ti;ao final do curso os participantes serao capazes de entender a estrutura da icp brasil e a legislacao pertinente conhecer a rotina operacional de uma autoridade de registro ar e estarao capacitados a atuarem como agentes de registro 
Row82;seguranca da informacao;ao final do curso o aluno devera ter compreendido como exercer a funcao de agente de seguranca 
Row83;desenvolvimento de solucoes;trocar experiencia entre os participantes sobre a importancia da cultura organizacional para uma efetiva adocao do metodo agil de desenvolvimento de sistemas 
Row84;desenvolvimento de solucoes;promover a comunicacao e a colaboracao entre seus integrantes visando a disseminacao coordenada da cultura agil por todo o pais 
Row85;desenvolvimento de solucoes;conferencia oficial da agile alliance brazil e se posiciona como uma das maiores do mundo na categoria o evento nao possui fins lucrativos e e organizado por um time de entusiastas da comunidade brasileira de metodos ageis que compartilham do objetivo de incentivar e disseminar a cultura agil por todo o pais 
Row86;desenvolvimento de solucoes;repassar conhecimentos adquiridos no treinamento agile coach professional da adaptworks 
Row87;desenvolvimento de solucoes;agregar conhecimento em agile scrum master conforme diretrizes do serpro
Row88;desenvolvimento de solucoes;trazer novidades surpresas e muita tendencia para o mercado de software os relatos dos participantes do agile trends mostram que os mesmos aprenderam muito e sairam do evento com muitas ideias novas e pensamentos fora da caixa por terem entrado em contato com opinioes e pontos de vista variados desta forma ter a oportunidade de mostrar ao brasil e ao mundo os resultados de um trabalho realizado por equipes do serpro se mostra bastante relevante alem disso tambem e uma grande oportunidade para saber como outras organizacoes estao trabalhando e propiciar networking com grandes nomes do mercado 
Row89;desenvolvimento de solucoes;o evento agile trends floripa traz tendencias em praticas e conceitos ageis a partir de palestras e relatos de experiencia de especialistas e outros praticantes o serpro ja utiliza metodos ageis ha alguns anos sempre buscando entregar mais valor de forma responsiva esta busca e refletida no oe do planejamento estrategico que visa a melhoria da qualidade e a reducao do tempo de entrega de valor ao cliente a participacao no evento permitira trazer novas ideias para serem disseminadas na empresa 
Row90;desenvolvimento de solucoes;este evento e a principal conferencia sobre tendencias e melhoras praticas em agilidade para o governo contara com apresentacoes de alto nivel de especialistas sobre o tema e de instituicoes publicas que tem obtido importantes resultados com a aplicacao de metodologias ageis os conhecimentos e ideias insights que serao adquiridos no evento poderao agregar valor e contribuir com o programa que esta em fase de proposicao conteudo programatico disponivel em http agiletrendsbr com programacao agile trends gov 
Row91;desenvolvimento de solucoes;trazer conteudo agil de primeira linha para o governo e seus prestadores de servico 
Row92;desenvolvimento de solucoes;o evento teve como objetivo apresentar as varias tendencias do setor tecnologico no que diz respeito ao tema agilidade com centenas de agilistas para a troca de experiencia e networking com varias apresentacoes de empresas do setor publico e privado 
Row93;desenvolvimento de solucoes;ao final da acao educacional o participante sera capaz de conhecer os fundamentos que alicercam a metodologia agil compreender a importancia de priorizar e ordenar atividades para entrega de valor e resultados aplicar elementos praticos da metodologia nas atividades de trabalho que realiza conhecer o que a metodologia preconiza recomenda orienta a respeito do trabalho em times e ter insumos para compreender a importancia da metodologia agil para o exito dos propositos organizacionais 
Row94;desenvolvimento de solucoes;apresentar os conceitos valores e principios do desenvolvimento agil de software para as equipes do departamento utilizando como referencia o kanban 
Row95;desenvolvimento de solucoes;a acao educacional tem como objetivo o compartilhamento de experiencia de desenvolvimento com membros de times ageis e gestores sem perda dos beneficios da comunicacao osmotica dos metodos ageis 
Row96;responsabilidade social;o objetivo deste curso e sensibilizar as pessoas para a necessidade de cada um nas suas acoes cotidianas praticar medidas de preservacao dos recursos hidricos alem de ajudar a disseminar as ideias aqui apresentadas buscando a adesao do maior numero possivel de pessoas para esta causa 
Row97;gestao de pessoas;ressaltar a importancia da cipa como amplo espaco de participacao proativa dos trabalhadores na construcao de um ambiente de trabalho saudavel a partir de um processo de negociacao cotidiana das questoes de seguranca e saude 
Row98;gestao empresarial;mostrar a importancia do gerenciamento de processos e da integridade para o resgate da confianca no servico publico 
Row99;ambientes de redes de ti;apresentar a infraestrutura da rede serpro 
Row100;ambientes de redes de ti;demonstrar como a internet pode conectar as pessoas informacoes e recursos em todo o mundo 
Row101;desenvolvimento de solucoes;apresentar os conceitos basicos que possibilitam a utilizacao da tecnica conhecida como ajax asynchronous javascript and xml ao final do treinamento os participantes devem ser capazes de realizar uma requisicao http assincrona ao servidor web recuperar dados e trata los para apresentacao em um documento html 
Row102;gestao de pessoas;orientar habitos alimentares e estilo de vida com promocao de saude aos participantes da acao educacional 
Row103;gestao de pessoas;fornecer informacoes sobre a dieta vegetariana buscando dirimir duvidas e desinformacao sobre o assunto 
Row104;desenvolvimento de solucoes;aproveitar a experiencia de aprendizado assistido por instrutor para fixacao do conteudo atraves de atividades praticas referentes ao uso do alm na visao do cliente apresentar as interacoes do cliente com a ferramenta alm 
Row105;centro de dados;capacitacao dos funcionarios em tecnologias da plataforma grande porte mainframe 
Row106;desenvolvimento de solucoes;apresentacao do sonarqube como ferramenta de analise de codigo e boas praticas para gestao da qualidade de codigo aplicar identificacao dimensionamento e correcao dos principais problemas em um projeto de componente java usado no serpro
Row107;gestao contabil;apresentar uma visao geral e abrangente de como analisar as demonstracoes contabeis 
Row108;centro de dados;apresentar o ferramental basico e os principais conceitos de analise de dados conceitos essenciais nos dominios da estatistica e mineracao de dados sao abordados de forma teorica e pratica abordando os seguintes pontos estimular nos alunos o raciocinio analitico sob diferentes perspectivas e classes de problemas discutir os conceitos fundamentais relativos aos principais algoritmos e tecnicas apresentar os principais problemas e tecnologias para extracao carga e transformacao de conjuntos de dados promover a discussao sobre estrategias e ferramental para processamento analitico escalavel de grandes volumes de dados e elaborar e executar projeto de ciencia de dados 
Row109;gestao contabil;apresentar uma visao geral e abrangente de como analisar as demonstracoes contabeis 
